작성일,평점,리뷰번역,연도,월,문장_번호,aspect,predicate,대분류,소분류,감성
1달 전,별표 5개,"궁궐은 조선 시대인 15세기에 건립되었으나, 16세기 일제강점기에 소실되었다가 곧바로 재건되어 이후 250년간 왕의 주요 거주지로 사용되었습니다.",2026,1.0,1,,,,,중립
1달 전,별표 5개,"궁궐과 주변 환경은 베이징의 자금성과 유사한 규모에도 불구하고, 유교 건축 원리에 따라 문, 안뜰, 주거 공간으로 구성되어 있습니다.",2026,1.0,2,규모,유사하다,2. 시각적 요소,볼거리 및 경관,중립
1달 전,별표 5개,"이 궁궐은 한국 건축과 정원 디자인에 중요한 영향을 미쳤으며, 서울 곳곳에서 그 흔적을 찾아볼 수 있습니다.",2026,1.0,3,영향,중요하다,1. 전반적 인식,종합 만족도,긍정
1달 전,별표 5개,"이 궁궐은 한국 건축과 정원 디자인에 중요한 영향을 미쳤으며, 서울 곳곳에서 그 흔적을 찾아볼 수 있습니다.",2026,1.0,3,흔적,찾아보다,1. 전반적 인식,종합 만족도,중립
1달 전,별표 5개,서울 한복판에 자리한 아름답고 인상적인 궁궐입니다.,2026,1.0,1,궁궐,아름답다,1. 전반적 인식,종합 만족도,긍정
1달 전,별표 5개,서울 한복판에 자리한 아름답고 인상적인 궁궐입니다.,2026,1.0,1,궁궐,인상적이다,1. 전반적 인식,종합 만족도,긍정
1달 전,별표 5개,건축 양식이 훌륭하고 주변 환경도 매우 잘 관리되어 있으며 조용합니다.,2026,1.0,2,양식,훌륭하다,2. 시각적 요소,볼거리 및 경관,긍정
1달 전,별표 5개,건축 양식이 훌륭하고 주변 환경도 매우 잘 관리되어 있으며 조용합니다.,2026,1.0,2,환경,관리되다,3. 시설 및 환경,공간 관리 상태,긍정
1달 전,별표 5개,건축 양식이 훌륭하고 주변 환경도 매우 잘 관리되어 있으며 조용합니다.,2026,1.0,2,환경,조용하다,3. 시설 및 환경,공간 관리 상태,긍정
1달 전,별표 5개,특히 겨울에는 호수가 얼어붙어 더욱 아름답습니다.,2026,1.0,3,호수,얼어붙다,2. 시각적 요소,볼거리 및 경관,긍정
1달 전,별표 5개,특히 겨울에는 호수가 얼어붙어 더욱 아름답습니다.,2026,1.0,3,호수,아름답다,2. 시각적 요소,볼거리 및 경관,긍정
1달 전,별표 5개,산책하고 사진을 찍으며 한국의 역사와 문화를 체험하기에 완벽한 장소입니다.,2026,1.0,4,장소,완벽하다,1. 전반적 인식,종합 만족도,긍정
1달 전,별표 5개,서울을 방문한다면 꼭 가봐야 할 곳입니다.,2026,1.0,5,곳,가보다,1. 전반적 인식,종합 만족도,긍정
1달 전,별표 5개,웅장하고 거대한 다양한 궁전과 정원들,2026,1.0,1,궁전,웅장하다,2. 시각적 요소,볼거리 및 경관,긍정
1달 전,별표 5개,웅장하고 거대한 다양한 궁전과 정원들,2026,1.0,1,궁전,거대하다,2. 시각적 요소,볼거리 및 경관,긍정
1달 전,별표 5개,웅장하고 거대한 다양한 궁전과 정원들,2026,1.0,1,정원,웅장하다,2. 시각적 요소,볼거리 및 경관,긍정
1달 전,별표 5개,웅장하고 거대한 다양한 궁전과 정원들,2026,1.0,1,정원,거대하다,2. 시각적 요소,볼거리 및 경관,긍정
1달 전,별표 4개,아름다운 역사 유적지이면서 활기 넘치는 곳입니다.,2026,1.0,1,유적지,아름답다,1. 전반적 인식,종합 만족도,긍정
1달 전,별표 4개,아름다운 역사 유적지이면서 활기 넘치는 곳입니다.,2026,1.0,1,곳,활기차다,1. 전반적 인식,종합 만족도,긍정
1달 전,별표 4개,자연과 역사적인 건물들이 조화롭게 어우러져 있어요.,2026,1.0,2,건물,조화롭다,2. 시각적 요소,볼거리 및 경관,긍정
1달 전,별표 4개,자연과 역사적인 건물들이 조화롭게 어우러져 있어요.,2026,1.0,2,건물,어우러지다,2. 시각적 요소,볼거리 및 경관,긍정
1달 전,별표 4개,겨울에 방문했는데도 사람들이 많았습니다.,2026,1.0,3,사람,많다,5. 이용 편의성,접근 및 물리적 여건,부정
1달 전,별표 4개,한복을 입고 오면 무료로 입장할 수 있어요.,2026,1.0,4,입장,무료하다,5. 이용 편의성,접근 및 물리적 여건,중립
1달 전,별표 4개,티켓은 미리 구매할 필요 없이 현장에서 구입할 수 있습니다.,2026,1.0,5,티켓,구입하다,5. 이용 편의성,접근 및 물리적 여건,중립
1달 전,별표 4개,꼭 가봐야 할 곳이에요.,2026,1.0,1,곳,가보다,1. 전반적 인식,종합 만족도,긍정
1달 전,별표 4개,하지만 봄에 가면 훨씬 더 활기찬 것 같아요.,2026,1.0,2,봄,활기차다,2. 시각적 요소,볼거리 및 경관,긍정
1달 전,별표 4개,"저희는 1월에 꽁꽁 얼어붙는 날씨에 갔었는데, 그다지 즐겁지는 않았어요.",2026,1.0,3,날씨,얼어붙다,5. 이용 편의성,접근 및 물리적 여건,부정
1달 전,별표 4개,"한 시간마다 근위병 교대식이 있는데, 정말 재미있고 꼭 볼 만해요.",2026,1.0,4,교대식,재미있다,4. 활동 및 서비스,체험 콘텐츠,긍정
1달 전,별표 4개,"한 시간마다 근위병 교대식이 있는데, 정말 재미있고 꼭 볼 만해요.",2026,1.0,4,교대식,볼만하다,4. 활동 및 서비스,체험 콘텐츠,긍정
1달 전,별표 4개,주변에도 볼거리가 많아요.,2026,1.0,5,볼거리,많다,2. 시각적 요소,볼거리 및 경관,긍정
1달 전,별표 4개,근처 여러 곳에서 한복을 대여할 수도 있어요.,2026,1.0,6,한복,대여하다,4. 활동 및 서비스,체험 콘텐츠,중립
1달 전,별표 5개,정문에서 10시에 시작되는 경비 교대식을 보려면 9시 30분쯤 가는 것을 추천합니다.,2026,1.0,1,교대식,시작되다,4. 활동 및 서비스,체험 콘텐츠,중립
1달 전,별표 5개,정문에서 10시에 시작되는 경비 교대식을 보려면 9시 30분쯤 가는 것을 추천합니다.,2026,1.0,1,교대식,추천하다,4. 활동 및 서비스,체험 콘텐츠,중립
1달 전,별표 5개,조금 일찍 시작하네요.,2026,1.0,2,,,,,중립
1달 전,별표 5개,많이 걸어야 해요.,2026,1.0,1,,,,,중립
1달 전,별표 5개,장소가 워낙 넓어서 반나절은 족히 걸릴 거예요.,2026,1.0,2,장소,넓다,5. 이용 편의성,접근 및 물리적 여건,중립
1달 전,별표 5개,"한복을 입으면 입장료가 무료지만, 그렇지 않으면 입장료를 내야 합니다.",2026,1.0,3,입장료,무료하다,5. 이용 편의성,접근 및 물리적 여건,중립
1달 전,별표 5개,"한복을 입으면 입장료가 무료지만, 그렇지 않으면 입장료를 내야 합니다.",2026,1.0,3,입장료,내다,5. 이용 편의성,접근 및 물리적 여건,중립
1달 전,별표 5개,1월 중순에 갔는데 날씨가 춥고 호수가 얼어 있었어요.,2026,1.0,4,날씨,춥다,5. 이용 편의성,접근 및 물리적 여건,부정
1달 전,별표 5개,1월 중순에 갔는데 날씨가 춥고 호수가 얼어 있었어요.,2026,1.0,4,호수,얼다,2. 시각적 요소,볼거리 및 경관,중립
1달 전,별표 5개,예쁜 사진 찍을 곳이 많아요.,2026,1.0,5,사진,예쁘다,2. 시각적 요소,볼거리 및 경관,긍정
1달 전,별표 5개,예쁜 사진 찍을 곳이 많아요.,2026,1.0,5,곳,많다,2. 시각적 요소,볼거리 및 경관,긍정
1달 전,별표 5개,정말 아름다운 곳입니다.,2026,1.0,6,곳,아름답다,2. 시각적 요소,볼거리 및 경관,긍정
1달 전,별표 5개,한복 문화를 배우기에 아주 좋은 곳이에요.,2026,1.0,7,문화,배우다,4. 활동 및 서비스,체험 콘텐츠,긍정
1달 전,별표 5개,한복 문화를 배우기에 아주 좋은 곳이에요.,2026,1.0,7,곳,좋다,4. 활동 및 서비스,체험 콘텐츠,긍정
1달 전,별표 5개,서울에 오시면 꼭 방문해야 할 곳입니다.,2026,1.0,1,곳,방문하다,1. 전반적 인식,종합 만족도,긍정
1달 전,별표 5개,"한국에서 꼭 가봐야 할 곳이며, 전통 한복을 입으면 더욱 좋습니다.",2026,1.0,1,곳,가다,1. 전반적 인식,종합 만족도,긍정
1달 전,별표 5개,"한국에서 꼭 가봐야 할 곳이며, 전통 한복을 입으면 더욱 좋습니다.",2026,1.0,1,한복,좋다,4. 활동 및 서비스,체험 콘텐츠,긍정
1달 전,별표 5개,"한복을 입고 거닐면 한국 문화에 더욱 깊이 몰입할 수 있고, 사진 찍기에도 더할 나위 없이 좋은 곳입니다.",2026,1.0,2,문화,몰입하다,4. 활동 및 서비스,체험 콘텐츠,긍정
1달 전,별표 5개,"한복을 입고 거닐면 한국 문화에 더욱 깊이 몰입할 수 있고, 사진 찍기에도 더할 나위 없이 좋은 곳입니다.",2026,1.0,2,사진,좋다,2. 시각적 요소,볼거리 및 경관,긍정
1달 전,별표 5개,"한복을 입고 거닐면 한국 문화에 더욱 깊이 몰입할 수 있고, 사진 찍기에도 더할 나위 없이 좋은 곳입니다.",2026,1.0,2,곳,좋다,2. 시각적 요소,볼거리 및 경관,긍정
1달 전,별표 5개,한복을 입고 이곳저곳을 둘러보는 것은 한국 여행을 더욱 의미 있고 기억에 남게 해 줄 것입니다.,2026,1.0,3,여행,의미있다,1. 전반적 인식,종합 만족도,긍정
1달 전,별표 5개,한복을 입고 이곳저곳을 둘러보는 것은 한국 여행을 더욱 의미 있고 기억에 남게 해 줄 것입니다.,2026,1.0,3,여행,남다,1. 전반적 인식,종합 만족도,긍정
1달 전,별표 5개,한국 여행에서 절대 놓쳐서는 안 될 곳입니다.,2026,1.0,4,,,,,긍정
1달 전,별표 2개,폐점했어요 😔😣…,2026,1.0,1,폐점,하다,5. 이용 편의성,접근 및 물리적 여건,부정
1달 전,별표 5개,서울에서 12시간 경유할 때 방문하기 좋은 멋진 곳입니다.,2026,1.0,1,곳,좋다,1. 전반적 인식,종합 만족도,긍정
1달 전,별표 5개,서울에서 12시간 경유할 때 방문하기 좋은 멋진 곳입니다.,2026,1.0,1,곳,멋지다,1. 전반적 인식,종합 만족도,긍정
1달 전,별표 5개,특히 오전 9시에 개장 시간에 맞춰 가면 혼자서 여유롭게 즐길 수 있어요.,2026,1.0,2,시간,여유롭다,5. 이용 편의성,접근 및 물리적 여건,긍정
1달 전,별표 5개,특히 오전 9시에 개장 시간에 맞춰 가면 혼자서 여유롭게 즐길 수 있어요.,2026,1.0,2,개장,맞추다,5. 이용 편의성,접근 및 물리적 여건,긍정
1달 전,별표 2개,볼거리나 즐길거리가 별로 없습니다.,2026,1.0,1,볼거리,없다,2. 시각적 요소,볼거리 및 경관,부정
1달 전,별표 2개,볼거리나 즐길거리가 별로 없습니다.,2026,1.0,1,즐길거리,없다,4. 활동 및 서비스,체험 콘텐츠,부정
1달 전,별표 5개,정말 아름다운 궁전이었어요.,2026,1.0,1,궁전,아름답다,2. 시각적 요소,볼거리 및 경관,긍정
1달 전,별표 5개,시어머니께서는 어렸을 적 이 궁전 앞 물가에서 스케이트를 타곤 했다고 말씀하셨죠.,2026,1.0,2,,,,,중립
1달 전,별표 5개,세월이 흐르고 장소가 변하는 것 같아요.,2026,1.0,3,세월,흐르다,1. 전반적 인식,종합 만족도,중립
1달 전,별표 5개,세월이 흐르고 장소가 변하는 것 같아요.,2026,1.0,3,장소,변하다,1. 전반적 인식,종합 만족도,중립
1달 전,별표 5개,"궁전은 그대로 남아있지만, 이곳에서 할 수 있는 것들도 많이 바뀌었네요.",2026,1.0,4,궁전,남다,2. 시각적 요소,볼거리 및 경관,중립
1달 전,별표 5개,"궁전은 그대로 남아있지만, 이곳에서 할 수 있는 것들도 많이 바뀌었네요.",2026,1.0,4,것,바뀌다,4. 활동 및 서비스,체험 콘텐츠,중립
1달 전,별표 5개,"훌륭한 문화 체험이었고, 마치 다른 세상을 엿보는 듯한 장엄한 경험이었어요.",2026,1.0,5,체험,훌륭하다,4. 활동 및 서비스,체험 콘텐츠,긍정
1달 전,별표 5개,"훌륭한 문화 체험이었고, 마치 다른 세상을 엿보는 듯한 장엄한 경험이었어요.",2026,1.0,5,경험,장엄하다,1. 전반적 인식,종합 만족도,긍정
1달 전,별표 5개,잠시 멈춰 서서 이런저런 생각을 해볼 수 있어서 정말 좋았습니다.,2026,1.0,6,생각,좋다,1. 전반적 인식,종합 만족도,긍정
1달 전,별표 5개,"아름다운 곳이긴 하지만, 제 생각엔 이곳에서 유일하게 흥미로운 점은 장소 자체였던 것 같아요.",2026,1.0,1,곳,아름답다,1. 전반적 인식,종합 만족도,긍정
1달 전,별표 5개,"아름다운 곳이긴 하지만, 제 생각엔 이곳에서 유일하게 흥미로운 점은 장소 자체였던 것 같아요.",2026,1.0,1,점,흥미롭다,1. 전반적 인식,종합 만족도,부정
1달 전,별표 5개,"원래 모습을 잘 보존하고 있어서 사진 찍기 좋은 곳도 많았지만, 아마도 관광객을 위해 조성된 곳인 것 같습니다.",2026,1.0,2,모습,보존하다,2. 시각적 요소,볼거리 및 경관,긍정
1달 전,별표 5개,"원래 모습을 잘 보존하고 있어서 사진 찍기 좋은 곳도 많았지만, 아마도 관광객을 위해 조성된 곳인 것 같습니다.",2026,1.0,2,곳,좋다,2. 시각적 요소,볼거리 및 경관,긍정
1달 전,별표 5개,"원래 모습을 잘 보존하고 있어서 사진 찍기 좋은 곳도 많았지만, 아마도 관광객을 위해 조성된 곳인 것 같습니다.",2026,1.0,2,곳,많다,3. 시설 및 환경,공간 관리 상태,중립
1달 전,별표 5개,현지인들은 (직원들을 제외하고는) 한 명도 보지 못했거든요.,2026,1.0,3,,,,,중립
1달 전,별표 4개,한국의 전통과 역사를 잘 알고 계시네요.,2026,1.0,1,,,,,긍정
1달 전,별표 5개,한국에서 가장 역사적인 장소 중 하나입니다.,2026,1.0,1,장소,역사적이다,1. 전반적 인식,종합 만족도,긍정
1달 전,별표 5개,둘러보는 데 약 1시간 30분 정도 소요됩니다.,2026,1.0,2,소요,되다,5. 이용 편의성,접근 및 물리적 여건,중립
1달 전,별표 5개,좋은 곳,2026,1.0,1,곳,좋다,1. 전반적 인식,종합 만족도,긍정
1달 전,별표 5개,사진발이 정말 잘 받아요!,2026,1.0,1,사진발,받다,2. 시각적 요소,볼거리 및 경관,긍정
1달 전,별표 5개,한복 입고 오시면 무료 입장입니다.,2026,1.0,2,,,,,중립
1달 전,별표 5개,불이 켜졌어요,2026,1.0,1,불,켜지다,2. 시각적 요소,볼거리 및 경관,중립
1달 전,별표 5개,"어린이는 무료였고, 어른은 3,000원이었습니다.",2026,1.0,1,,,,,중립
1달 전,별표 5개,한복을 입으면 무료였습니다.,2026,1.0,2,,,,,중립
1달 전,별표 5개,아름다운 건물과 풍경이 펼쳐져 있었습니다.,2026,1.0,3,건물,아름답다,2. 시각적 요소,볼거리 및 경관,긍정
1달 전,별표 5개,아름다운 건물과 풍경이 펼쳐져 있었습니다.,2026,1.0,3,풍경,펼쳐지다,2. 시각적 요소,볼거리 및 경관,긍정
1달 전,별표 5개,서울 도심 한복판에 있는 유서 깊은 역사 유적지를 방문할 수 있어서 정말 좋았습니다.,2026,1.0,4,유적지,좋다,1. 전반적 인식,종합 만족도,긍정
1달 전,별표 5개,"날씨가 추워서 오래 머물지 못해 아쉬웠지만, 구석구석 다 둘러보려면 만 계단을 오르내려야 할 거예요.",2026,1.0,5,날씨,춥다,5. 이용 편의성,접근 및 물리적 여건,부정
1달 전,별표 5개,저희는 인파를 피하기 위해 아침 일찍 방문했습니다.,2026,1.0,6,,,,,중립
1달 전,별표 5개,많은 베트남 관광객들이 이 궁궐을 방문합니다.,2026,1.0,1,,,,,중립
1달 전,별표 5개,규모가 매우 커서 둘러보는 데 약 두 시간이 걸립니다.,2026,1.0,2,규모,크다,5. 이용 편의성,접근 및 물리적 여건,중립
1달 전,별표 5개,"오전에는 궁궐의 과거 의식을 재현하는 행사가 열리는데, 매우 웅장하고 엄숙한 분위기를 자아냅니다.",2026,1.0,3,분위기,웅장하다,4. 활동 및 서비스,체험 콘텐츠,긍정
1달 전,별표 5개,"오전에는 궁궐의 과거 의식을 재현하는 행사가 열리는데, 매우 웅장하고 엄숙한 분위기를 자아냅니다.",2026,1.0,3,분위기,엄숙하다,4. 활동 및 서비스,체험 콘텐츠,긍정
1달 전,별표 5개,그 외에도 박물관과 다양한 시대의 주거 및 거리 건축 양식을 보여주는 모형들이 있어 구경하는 재미도 쏠쏠하고 아름다운 사진을 찍을 기회도 많습니다.,2026,1.0,4,재미,쏠쏠하다,4. 활동 및 서비스,체험 콘텐츠,긍정
1달 전,별표 5개,그 외에도 박물관과 다양한 시대의 주거 및 거리 건축 양식을 보여주는 모형들이 있어 구경하는 재미도 쏠쏠하고 아름다운 사진을 찍을 기회도 많습니다.,2026,1.0,4,사진,아름답다,2. 시각적 요소,볼거리 및 경관,긍정
1달 전,별표 5개,그 외에도 박물관과 다양한 시대의 주거 및 거리 건축 양식을 보여주는 모형들이 있어 구경하는 재미도 쏠쏠하고 아름다운 사진을 찍을 기회도 많습니다.,2026,1.0,4,기회,많다,2. 시각적 요소,볼거리 및 경관,긍정
1달 전,별표 5개,제가 한국에서 가장 좋아하는 장소 중 하나예요 🤍…,2026,1.0,1,장소,좋다,1. 전반적 인식,종합 만족도,긍정
1달 전,별표 5개,궁전과 주변 지역에는 볼거리가 많아 반나절 이상은 쉽게 보낼 수 있습니다.,2026,1.0,1,볼거리,많다,2. 시각적 요소,볼거리 및 경관,긍정
1달 전,별표 5개,"궁전 앞에서 열리는 근위병 교대식은 하루를 시작하는 아름다운 방법이니, 미리 시간을 확인하세요.",2026,1.0,2,방법,아름답다,4. 활동 및 서비스,체험 콘텐츠,긍정
1달 전,별표 5개,전통 의상을 입으면 궁전 입장료가 무료입니다.,2026,1.0,3,,,,,중립
1달 전,별표 5개,"티켓은 정문 바로 안쪽에 있는 셀프 서비스 키오스크에서 구매할 수 있는데, 신용카드만 사용 가능하니 줄이 더 빨리 줄어듭니다.",2026,1.0,4,줄,줄어들다,5. 이용 편의성,접근 및 물리적 여건,긍정
1달 전,별표 5개,(온라인으로 미리 구매할 수도 있습니다.) 이 지역에는 안내를 해주는 직원들이 많이 있습니다.,2026,1.0,5,직원,많다,4. 활동 및 서비스,체험 콘텐츠,중립
1달 전,별표 5개,"데이터가 있다면 휴대폰에 무료 투어 지도를 다운로드하거나, 종이 지도를 받을 수도 있습니다(유료일 수 있음).",2026,1.0,6,,,,,중립
1달 전,별표 5개,티켓을 받는 두 번째 문을 지나면 인파가 줄어듭니다.,2026,1.0,7,인파,줄어들다,5. 이용 편의성,접근 및 물리적 여건,긍정
1달 전,별표 5개,"저희는 평일에 갔는데도 붐볐지만, 주말이나 공휴일에는 훨씬 더 붐빌 것 같습니다.",2026,1.0,8,,,,,부정
1달 전,별표 5개,궁전 안에는 출구가 여러 개 있어서 왔던 길을 되돌아갈 필요가 없어 편리합니다.,2026,1.0,9,궁전,편리하다,5. 이용 편의성,접근 및 물리적 여건,긍정
1달 전,별표 5개,꽤 많이 걸어야 하고 길이 항상 매끄럽지는 않으니 편안한 신발을 착용하는 것이 좋습니다.,2026,1.0,10,길,매끄럽다,3. 시설 및 환경,공간 관리 상태,부정
1달 전,별표 5개,꽤 많이 걸어야 하고 길이 항상 매끄럽지는 않으니 편안한 신발을 착용하는 것이 좋습니다.,2026,1.0,10,신발,편안하다,5. 이용 편의성,접근 및 물리적 여건,중립
1달 전,별표 5개,"건물과 정원은 정말 아름다우니, 안내 표지판을 잘 지켜주세요.",2026,1.0,11,건물,아름답다,2. 시각적 요소,볼거리 및 경관,긍정
1달 전,별표 5개,"건물과 정원은 정말 아름다우니, 안내 표지판을 잘 지켜주세요.",2026,1.0,11,정원,아름답다,2. 시각적 요소,볼거리 및 경관,긍정
1달 전,별표 5개,"저희는 몇몇 사람들이 인스타그램 사진을 찍으려고 규칙을 어기거나, 다른 사람들을 밀치고 사진을 찍는 모습을 봤습니다.",2026,1.0,12,,,,,부정
1달 전,별표 5개,"만약 궁궐에 대해 미리 알아보지 않았다면, 투어에 참여하는 것이 더 잘 이해하는 데 도움이 될 것입니다.",2026,1.0,13,투어,도움되다,4. 활동 및 서비스,체험 콘텐츠,중립
1달 전,별표 5개,여러 언어로 투어가 제공되는 점도 좋았습니다.,2026,1.0,14,투어,좋다,4. 활동 및 서비스,체험 콘텐츠,긍정
1달 전,별표 5개,"즐거운 시간 보내시고, 수분 섭취를 잊지 마세요.",2026,1.0,15,시간,즐겁다,1. 전반적 인식,종합 만족도,긍정
1달 전,별표 5개,"궁궐 안에 작은 카페가 있지만, 특히 더운 날에는 물이나 간식을 챙겨가는 것이 좋습니다.",2026,1.0,16,카페,작다,4. 활동 및 서비스,체험 콘텐츠,중립
1달 전,별표 5개,"역사 애호가, 역사적인 건축물을 좋아하는 사람, 그리고 한국 드라마 팬이라면 꼭 방문해야 할 곳입니다.",2026,1.0,17,,,,,긍정
1달 전,별표 5개,경복궁을 방문했다면 바로 옆에 있는 국립고궁박물관에 들르는 것은 필수 코스입니다.,2026,1.0,1,,,,,긍정
1달 전,별표 5개,한국의 길고도 파란만장했던 역사가 이곳에서는 명확하고 품격 있게 펼쳐집니다.,2026,1.0,2,역사,길다,1. 전반적 인식,종합 만족도,긍정
1달 전,별표 5개,한국의 길고도 파란만장했던 역사가 이곳에서는 명확하고 품격 있게 펼쳐집니다.,2026,1.0,2,역사,파란만장하다,1. 전반적 인식,종합 만족도,긍정
1달 전,별표 5개,한국의 길고도 파란만장했던 역사가 이곳에서는 명확하고 품격 있게 펼쳐집니다.,2026,1.0,2,역사,명확하다,1. 전반적 인식,종합 만족도,긍정
1달 전,별표 5개,한국의 길고도 파란만장했던 역사가 이곳에서는 명확하고 품격 있게 펼쳐집니다.,2026,1.0,2,역사,품격있다,1. 전반적 인식,종합 만족도,긍정
1달 전,별표 5개,"박물관은 단순한 유물 전시를 넘어, 침략과 점령, 그리고 극심한 시련 속에서도 굴하지 않고 성장해 온 한 나라의 이야기를 들려줍니다.",2026,1.0,3,시련,극심하다,4. 활동 및 서비스,체험 콘텐츠,긍정
1달 전,별표 5개,"왕실 유물, 문서, 그리고 세심하게 보존된 유물들을 통해 방문객들은 한국이 어떻게 반복되는 국가적 시련을 극복하고 정체성, 문화, 그리고 사명감을 지켜냈는지 이해하게 됩니다.",2026,1.0,4,유물,세심하다,4. 활동 및 서비스,체험 콘텐츠,긍정
1달 전,별표 5개,"왕실 유물, 문서, 그리고 세심하게 보존된 유물들을 통해 방문객들은 한국이 어떻게 반복되는 국가적 시련을 극복하고 정체성, 문화, 그리고 사명감을 지켜냈는지 이해하게 됩니다.",2026,1.0,4,유물,보존되다,4. 활동 및 서비스,체험 콘텐츠,긍정
1달 전,별표 5개,이러한 역경과 회복의 여정은 현대적이고 자신감 넘치며 미래지향적인 현재의 한국을 더욱 의미 있게 만들어 줍니다.,2026,1.0,5,한국,현대적이다,1. 전반적 인식,종합 만족도,긍정
1달 전,별표 5개,이러한 역경과 회복의 여정은 현대적이고 자신감 넘치며 미래지향적인 현재의 한국을 더욱 의미 있게 만들어 줍니다.,2026,1.0,5,한국,자신감넘치다,1. 전반적 인식,종합 만족도,긍정
1달 전,별표 5개,이러한 역경과 회복의 여정은 현대적이고 자신감 넘치며 미래지향적인 현재의 한국을 더욱 의미 있게 만들어 줍니다.,2026,1.0,5,한국,미래지향적이다,1. 전반적 인식,종합 만족도,긍정
1달 전,별표 5개,이러한 역경과 회복의 여정은 현대적이고 자신감 넘치며 미래지향적인 현재의 한국을 더욱 의미 있게 만들어 줍니다.,2026,1.0,5,한국,의미있다,1. 전반적 인식,종합 만족도,긍정
1달 전,별표 5개,"궁궐과 박물관은 함께 강력한 역사적 연속성을 만들어내며, 방문객들에게 한국의 왕실 역사를 감상할 뿐만 아니라 한국이 오늘날 세계 무대에서 차지하는 위상에 이르기까지 걸어온 놀라운 여정을 되새기게 해 줍니다.",2026,1.0,6,연속성,강력하다,1. 전반적 인식,종합 만족도,긍정
1달 전,별표 5개,"궁궐과 박물관은 함께 강력한 역사적 연속성을 만들어내며, 방문객들에게 한국의 왕실 역사를 감상할 뿐만 아니라 한국이 오늘날 세계 무대에서 차지하는 위상에 이르기까지 걸어온 놀라운 여정을 되새기게 해 줍니다.",2026,1.0,6,여정,놀랍다,1. 전반적 인식,종합 만족도,긍정
1달 전,별표 5개,20260111.,2026,1.0,1,,,,,중립
1달 전,별표 4개,아름다운 궁궐이라 둘러보기에 좋습니다.,2026,1.0,1,궁궐,아름답다,2. 시각적 요소,볼거리 및 경관,긍정
1달 전,별표 4개,아름다운 궁궐이라 둘러보기에 좋습니다.,2026,1.0,1,궁궐,좋다,2. 시각적 요소,볼거리 및 경관,긍정
1달 전,별표 4개,경내는 그리 넓지 않아요.,2026,1.0,2,경내,넓다,3. 시설 및 환경,공간 관리 상태,중립
1달 전,별표 4개,한복을 입으면 무료로 입장할 수 있습니다.,2026,1.0,3,,,,,중립
1달 전,별표 5개,한국 드라마에 나올 것 같은 녀석.,2026,1.0,1,,,,,중립
1달 전,별표 5개,망했어.,2026,1.0,2,,,,,부정
